{"schema_version":"prc.control-classification-skeptic-review/v0.1","packet_id":"skeptic-docs-engineering-08-security-and-cryptography-md-part-002-part-002","primary_packet_id":"docs-engineering-08-security-and-cryptography-md-part-002","methodology_sha256":"a98007a2924a71405acd5d084577c9675a293d8eec43b9e06a37b743e3bec433","registry_version":"0.1.0","registry_sha256":"7448c14fd9e3c3ce7a1fa9ea28a2ce98f8d0a1a3fe55239ba1d4715c4870bc9b","controls":[{"control_id":"USEQ-3824B918","revision":1,"semantic_sha256":"3824b91851161a90912db4a76bbc31d4664752d866df31ddb7b683c2df74ef68","verdict":"rejected_nondeterministic","reason":"Identifying every affected asset, artifact, device and relying party requires a complete, current cryptographic dependency and deployment inventory.","counterexample_analysis":"The structured impact record can list all registered objects while an offline device or undocumented relying party still trusts the compromised key, so the record passes while impact coverage is incomplete.","nondeterministic_route":"unbounded_claim","nondeterministic_reason_codes":["unbounded_scope"],"review_status":"skeptical_agent_reviewed"},{"control_id":"USEQ-D6AA53D3","revision":1,"semantic_sha256":"d6aa53d3c386642be81d331518b40e1d36ad6d0c38e808d114cb8c4f4a07fc11","verdict":"rejected_nondeterministic","reason":"The rule leaves both the meaning of regularly and the success oracle for emergency rotation and recovery tests unspecified.","counterexample_analysis":"A team can record an annual exercise that invokes both loss scenarios but never restores an offline consumer; the generic test record passes although cadence and recovery effectiveness may be unacceptable.","nondeterministic_route":"contract_incomplete","nondeterministic_reason_codes":["undefined_protocol","undefined_threshold"],"review_status":"skeptical_agent_reviewed"},{"control_id":"USEQ-E02F6368","revision":1,"semantic_sha256":"e02f6368244725142e14c724f575ba4b5b660c83a2bd675bad64264343934187","verdict":"rejected_nondeterministic","reason":"Preventing every old backup restore from reintroducing five classes of revoked or vulnerable state requires exhaustive backup and restore-path coverage.","counterexample_analysis":"Tests for all registered backup jobs can pass while an untracked operator snapshot restores an old trust anchor or vulnerable binary into production.","nondeterministic_route":"unbounded_claim","nondeterministic_reason_codes":["unbounded_scope"],"review_status":"skeptical_agent_reviewed"},{"control_id":"USEQ-90908C45","revision":1,"semantic_sha256":"90908c45034abf2c3c8678fb0f8ee8ae6fd1b51d43121bb504a3ec6130342b60","verdict":"rejected_nondeterministic","reason":"A root-cause review requires causal judgment, and updating seven artifacts correctly requires deciding which changes the incident evidence actually warrants.","counterexample_analysis":"All seven documents can receive timestamp-only edits and the review can name the immediate fault while missing the systemic cause; presence checks would pass a substantively broken response.","nondeterministic_route":"mixed","nondeterministic_reason_codes":["contextual_judgment","mixed_with_nondeterministic_child","undefined_protocol"],"review_status":"skeptical_agent_reviewed"},{"control_id":"USEQ-F2957839","revision":1,"semantic_sha256":"f2957839e0a1541a633d9c9de511f1bac7e4a614910dbf688025df92bbe803b6","verdict":"rejected_nondeterministic","reason":"The release decision depends on contextual materiality and on proving complete discovery and ownership of cryptographic uses, keys, data and dependencies.","counterexample_analysis":"Every recorded material item can have an owner while an undocumented signing key is incorrectly deemed immaterial; the gate passes although a material cryptographic dependency remains uninventoried.","nondeterministic_route":"mixed","nondeterministic_reason_codes":["contextual_judgment","mixed_with_nondeterministic_child","unbounded_scope"],"review_status":"skeptical_agent_reviewed"},{"control_id":"USEQ-24D458E7","revision":1,"semantic_sha256":"24d458e7eea1b7ba2f6332b18a258cd756bf8d59dfbc4f7b2cca541a09173988","verdict":"rejected_nondeterministic","reason":"Absence of embedded keys across source, artifacts, clients, logs, tickets, documents and storage is an open-world negative claim over incomplete repositories.","counterexample_analysis":"Configured secret scanners can report clean results while an encoded key remains in an archived ticket attachment or compiled client asset outside their recognized formats.","nondeterministic_route":"unbounded_claim","nondeterministic_reason_codes":["unbounded_scope"],"review_status":"skeptical_agent_reviewed"},{"control_id":"USEQ-1781A243","revision":1,"semantic_sha256":"1781a243fcf0cfaf413361c32741d25eeb0133d9072d42622bc9edc1b132b9c5","verdict":"rejected_nondeterministic","reason":"Whether the six cryptographic failures are known or reasonably suspected requires specialist interpretation of incomplete evidence and adversarial behavior.","counterexample_analysis":"All tracked findings can be closed and bounded tests can pass while repeated ciphertext patterns reasonably indicate nonce reuse that the configured oracle does not recognize.","nondeterministic_route":"specialist_or_legal_judgment","nondeterministic_reason_codes":["legal_or_specialist_authority"],"review_status":"skeptical_agent_reviewed"},{"control_id":"USEQ-9FD289E2","revision":1,"semantic_sha256":"9fd289e23fad8fa6f54dc8efa760fe48dbdea85313c64e8dc0510917978c55aa","verdict":"rejected_nondeterministic","reason":"Verification of recovery, consumer adoption, dependent artifacts and rollback implications requires complete inventories plus substantive operational impact judgment.","counterexample_analysis":"All registered consumers can acknowledge the new key and a recovery drill can pass while an offline verifier and archived signed artifact are omitted, making rotation irreversible for them.","nondeterministic_route":"mixed","nondeterministic_reason_codes":["mixed_with_nondeterministic_child","undefined_protocol","unbounded_scope"],"review_status":"skeptical_agent_reviewed"}]}
