{"schema_version":"prc.control-classification-skeptic-review/v0.1","packet_id":"skeptic-docs-engineering-16-specialized-domains-and-release-assurance-md-part-003-part-001","primary_packet_id":"docs-engineering-16-specialized-domains-and-release-assurance-md-part-003","methodology_sha256":"a98007a2924a71405acd5d084577c9675a293d8eec43b9e06a37b743e3bec433","registry_version":"0.1.0","registry_sha256":"7448c14fd9e3c3ce7a1fa9ea28a2ce98f8d0a1a3fe55239ba1d4715c4870bc9b","controls":[{"control_id":"USEQ-E8034D11","revision":1,"semantic_sha256":"e8034d1133b9795ae21cbd44f32141f1e50ff8c1c826b6af245266878e00020a","verdict":"rejected_nondeterministic","reason":"Approved status fixtures do not exhaust export formats, print paths, verifier states, or what presentation would materially misstate to a relying party.","counterexample_analysis":"Tested PDF and paper outputs match the verifier, while an offline QR export displays valid after the credential is revoked.","nondeterministic_route":"empirical_protocol_undefined","nondeterministic_reason_codes":["undefined_protocol","undefined_scope","contextual_judgment"],"review_status":"skeptical_agent_reviewed"},{"control_id":"USEQ-271DE6C6","revision":1,"semantic_sha256":"271de6c660fb738c510515e655a12084563a0de949a048a4e93235f93b5c2e39","verdict":"rejected_nondeterministic","reason":"Which alternatives are required and what constitutes eligibility are legal and policy judgments, and complete decision-path coverage is not bounded.","counterexample_analysis":"The tested wallet format falls back correctly, while an applicant without that wallet is denied despite a legally required paper alternative.","nondeterministic_route":"specialist_or_legal_judgment","nondeterministic_reason_codes":["legal_or_specialist_authority","undefined_scope","human_accountability"],"review_status":"skeptical_agent_reviewed"},{"control_id":"USEQ-FD3F890D","revision":1,"semantic_sha256":"fd3f890d9206fdcef870fe6a52c1302cba121d7a25aefbe737e0f8d78e9f396d","verdict":"rejected_nondeterministic","reason":"Dates and plan records are checkable, but complete obsolescence inventory, advance sufficiency, and approval validity are not.","counterexample_analysis":"Every registered issuer with an end date has a prior plan, while an unregistered dependency becomes obsolete and strands credentials.","nondeterministic_route":"mixed","nondeterministic_reason_codes":["mixed_with_nondeterministic_child","undefined_scope","human_accountability"],"review_status":"skeptical_agent_reviewed"},{"control_id":"USEQ-5E18FC51","revision":1,"semantic_sha256":"5e18fc51514c08d6f7f820e699f7bb71dc2ce821f7f754ce5420a594cfc59023","verdict":"rejected_nondeterministic","reason":"One test per named scenario cannot cover combinations, timings, status states, relying parties, or define correct recovery outcomes.","counterexample_analysis":"All six fixtures pass separately, while issuer retirement during registry outage causes an offline verifier to accept a revoked credential.","nondeterministic_route":"empirical_protocol_undefined","nondeterministic_reason_codes":["undefined_protocol","undefined_scope","undefined_threshold"],"review_status":"skeptical_agent_reviewed"},{"control_id":"USEQ-BEB1A131","revision":1,"semantic_sha256":"beb1a13110a7aebf8dde4b835054492878ace578e1ef37780447771c931bd4ae","verdict":"rejected_nondeterministic","reason":"Future service changes and the evidence required for all long-lived credential types cannot be completely enumerated or validated by present fixtures.","counterexample_analysis":"Fixtures survive a simulated outage, while retirement of the timestamp authority makes a decade-old signature unverifiable.","nondeterministic_route":"unbounded_claim","nondeterministic_reason_codes":["unbounded_scope","undefined_scope","undefined_protocol"],"review_status":"skeptical_agent_reviewed"},{"control_id":"USEQ-942AB317","revision":1,"semantic_sha256":"942ab317c010be2f45302ff68c43297ed89b08b58d375dce6be15631fa5c757f","verdict":"rejected_nondeterministic","reason":"Every downgrade attempt spans encodings, negotiation paths, algorithms, status modes, and future attacker strategies without a complete formal state space.","counterexample_analysis":"Known algorithm downgrades are rejected, while an alternate ambiguous encoding selects a weaker status check.","nondeterministic_route":"unbounded_claim","nondeterministic_reason_codes":["unbounded_scope","undefined_scope","undefined_protocol"],"review_status":"skeptical_agent_reviewed"},{"control_id":"USEQ-1B9B5CDF","revision":1,"semantic_sha256":"1b9b5cdf8b6b0fbbfc0ba0894fedb819b7eeeaa21ba46aae77794ea96d275a4f","verdict":"rejected_nondeterministic","reason":"Two implementations passing selected flows does not prove full profile interoperability, independence, error semantics, extensions, and boundary behavior.","counterexample_analysis":"Both implementations pass ordinary issuance and presentation, while they canonicalize duplicate claims differently and reject each other's edge-case credential.","nondeterministic_route":"empirical_protocol_undefined","nondeterministic_reason_codes":["undefined_protocol","undefined_scope","undefined_threshold"],"review_status":"skeptical_agent_reviewed"},{"control_id":"USEQ-137674FC","revision":1,"semantic_sha256":"137674fc913d0fdf4c84af77ba20319b210f4c39915cb153de8b321198a52de7","verdict":"rejected_nondeterministic","reason":"Evidence that six test categories ran cannot prove representative scope, correct oracles, qualified review, or acceptable results.","counterexample_analysis":"Each category has a completed report, while keyboard users cannot complete presentation and the accessibility test never exercises that flow.","nondeterministic_route":"empirical_protocol_undefined","nondeterministic_reason_codes":["undefined_protocol","undefined_scope","undefined_threshold"],"review_status":"skeptical_agent_reviewed"},{"control_id":"USEQ-48D94432","revision":1,"semantic_sha256":"48d944328d0dad86cef3524f279f996d9f93ced1cd7131f1c7adc502591c93b2","verdict":"rejected_nondeterministic","reason":"Metric-series presence does not establish complete ecosystem coverage, meaningful baselines, thresholds, or detection of all named harms.","counterexample_analysis":"All six dashboards exist, while cross-wallet mass correlation is untagged and remains invisible.","nondeterministic_route":"empirical_protocol_undefined","nondeterministic_reason_codes":["undefined_protocol","undefined_scope","undefined_threshold"],"review_status":"skeptical_agent_reviewed"},{"control_id":"USEQ-07A28D8C","revision":1,"semantic_sha256":"07a28d8c2fff69fd6f98641eda276530d27d66233f1330b634c1e98536920b73","verdict":"rejected_nondeterministic","reason":"Contacts and an exercise record cannot prove every relevant party is included or that coordination is timely, authorized, and effective in a real incident.","counterexample_analysis":"The plan lists five party types and a tabletop, but the issuer's contact lacks revocation authority during an actual compromise.","nondeterministic_route":"accountable_human_decision","nondeterministic_reason_codes":["human_accountability","undefined_scope","contextual_judgment"],"review_status":"skeptical_agent_reviewed"}]}
